{
  "version": "6.0",
  "file": "/Users/hubby/Workspace/xuan-jiang/plugins/writing-polish/skills/writing-polish/assets/real-world-anchors/06-cicpa-consulting-template.md",
  "draft_hash": "04915c09b745d193",
  "exit_code": 1,
  "summary": {
    "red_line_violations_total": 4,
    "soft_warnings_total": 0,
    "categories": [
      {
        "name": "§1.4 标点红线（阈值 = 0）",
        "red": 4,
        "soft": 0
      }
    ]
  },
  "stats": {
    "char_count": 1936,
    "sentence_count": 28,
    "paragraph_count": 21
  },
  "human_readable_output": "================================================\n       AI 味红线扫描 v4.3\n       文件：/var/folders/zj/nrnsj_1x7px29mb1h_xdrw140000gn/T/scan-ai-taste.XXXXXX.md.QE3fSKFJVB\n================================================\n\n▼ §1.4 标点红线（阈值 = 0）\n  ✗ 破折号: 2 处 (须 = 0)\n    29:1. **第三方咨询身份边界**：开篇不写\"按 X 协会规划编制\"或\"贯彻 Y 文件精神\"等帽子，直接进入判断。咨询机构是独立第三方，不锚甲方自家规划——这是与\"甲方内设处室文件\"的关键区别。\n    47:「按 X 协会规划编制」帽子在咨询机构对甲方的报告里是**严重越界**——这是甲方内设处室文件的格式，咨询机构不应锚到甲方自家规划，而应保持第三方判断者的身份。同理，\"贯彻Y讲话精神\"等政治承接句式不出现在咨询交付物。\n  ✓ 括号内补充 = 0\n  ✗ §1.4.111 ASCII 直引号（中文上下文）: 9\n  23:> 省级层面，浙江省\"浙政钉\"系国内规模最大的政务协同平台。据浙江省数字经济发展中心刊于《信息化建设》2025 年第 5 期的研究，2024 年\"浙政钉\"推动省市县乡村网格六级共 210 万政务人员实现组织在线、沟通在线、业务在线，日活跃用\n  29:1. **第三方咨询身份边界**：开篇不写\"按 X 协会规划编制\"或\"贯彻 Y 文件精神\"等帽子，直接进入判断。咨询机构是独立第三方，不锚甲方自家规划——这是与\"甲方内设处室文件\"的关键区别。\n  31:2. **结论先行 + 证据支撑**：每段第一句给出判断（\"信息系统部署方式已由自建机房转向政务云\"），后续段落用具体单位、平台、数据展开论证。读者扫读首句即可掌握主要观点。\n  33:3. **数据极其具体**：精确到日活（170 万）、占比（81%）、单位个数（70 余万人）、年份（2025 年第 5 期）、平台名（浙政钉 / 粤政易 / 京办），不用\"大量\"\"显著\"\"若干\"等模糊量词。\n  35:4. **不为特定厂商背书**：用功能描述（\"一体化智能平台\"）而非产品名（不指名\"钉钉\"或\"飞书\"）；多家国际协会并列时给完整缩写（AICPA / FRC / ISCA / JICPA），不偏向任何一家。\n  ✗ §1.4.111 直角引号 「」『』（港台 / 日式）: 2\n  47:「按 X 协会规划编制」帽子在咨询机构对甲方的报告里是**严重越界**——这是甲方内设处室文件的格式，咨询机构不应锚到甲方自家规划，而应保持第三方判断者的身份。同理，\"贯彻Y讲话精神\"等政治承接句式不出现在咨询交付物。\n  49:「请审定 / 请批示 / 妥否」等公文请示稿专属套语在咨询报告中也是身份越界。咨询交付的结尾不加\"以上...请...\"类专门收束句，对标国际咨询公司报告范式，平实结束。\n  ✗ §1.4.112 数学符号代替自然语言（+ = →）: 3\n  5:**特征**：判断先行 + 具体数据 + 不锚甲方规划 + 不背书厂商 + 不暴露内部沟通\n  31:2. **结论先行 + 证据支撑**：每段第一句给出判断（\"信息系统部署方式已由自建机房转向政务云\"），后续段落用具体单位、平台、数据展开论证。读者扫读首句即可掌握主要观点。\n  37:5. **多方利益话题先静默**：方案中触动多方内容主权或费用流的话题（继续教育在线平台涉北京 / 上海 / 厦门三家国家会计学院 + 地方注协）不引入\"AI 能力\"等敏感主张，写到现状即止。\n  ✓ §1.4.113 中英紧贴缝合词（无空格） = 0\n  ✓ §1.4.117 中文段落英文标点穿插 = 0\n  ✓ §1.4.114 每段加粗冒号开头 = 0\n\n▼ §1.3 句式红线（阈值 = 0）\n  ✓ 否定平行结构 = 0\n  ✓ 如果说...那么... = 0\n\n▼ §1.1 中文词汇红线（阈值 = 0）\n  ✓ 中文红线词命中 = 0\n\n▼ §1.2 英文词汇红线（阈值 = 0）\n  ✓ 英文红线词命中 = 0\n\n▼ §1.1 三段式套壳（阈值 = 0）\n  ✓ 首先...其次...最后 = 0\n\n▼ §4 软阈值（密度限制，文长 26 句 → 千句密度阈值动态计算）\n  ✓ 已经: 0 / 阈值 ≤ 3\n  ✓ 核心: 0 / 阈值 ≤ 3\n  ✓ 这一: 0 / 阈值 ≤ 2\n\n▼ §1.5 戏剧化 / 大厂黑话 / 网络口语（阈值 = 0）\n  ✓ §1.5.1 战斗化叙事 = 0\n  ✓ §1.5.2 互联网大厂黑话 = 0\n  ✓ §1.5.3 网络口语 / 网感词 = 0\n  ✓ §1.5.4 程序员 / 产品经理腔 = 0\n\n▼ §1.6 元注释 / 客服话术（阈值 = 0）\n  ✓ §1.6.1 元注释开头 = 0\n  ✓ §1.6.2 自我介绍 = 0\n  ✓ §1.6.3 免责声明 = 0\n  ✓ §1.6.4 服务话术段尾 = 0\n  ✓ §1.6.5 拟人化集体代词 = 0\n\n▼ §1.7 Wikipedia 长尾盲区（阈值 = 0）\n  ✓ §1.7.1 Reference markup bugs = 0\n  ✓ §1.7.2 Placeholder dates = 0\n  ✓ §1.7.5 Inline-header 段首标题 = 0\n  ✓ §1.7.7 Thematic breaks: 2 / 阈值 ≤ 5\n\n▼ §3 结构反模式（启发式提示）\n  ✓ 段尾分词挂总结: 0 处\n  ✓ 挑战与展望套壳 = 0\n\n▼ 句长方差（阈值 ≥ 8）\n  ✓ 句长标准差: 24.0 / 平均 53 字 / 句子数 26\n\n▼ 分组密度报表（按 anti-ai-taste-anchors.md 章节）\n  §1.1: 0 处\n  §1.2: 0 处\n  §1.3: 0 处\n  §1.4: 16 处\n  §1.5: 0 处\n  §1.6: 0 处\n  §1.7: 0 处\n\n================================================\n✗ FAIL — 有 4 项硬红线违规，禁止交付\n\n提示：加 --suggest-fix 获取改写建议；或运行 bash scripts/auto-fix-loop.sh \"$FILE\" 自动尝试 1 至 2 轮修复\n下一步：重写违规处，再次运行本脚本，直至全部通过\n"
}
