{
  "version": "6.0",
  "file": "/Users/hubby/Workspace/xuan-jiang/plugins/writing-polish/skills/writing-polish/assets/real-world-anchors/01-state-council-mobile-gov.md",
  "draft_hash": "bcb1ef19988fb287",
  "exit_code": 1,
  "summary": {
    "red_line_violations_total": 2,
    "soft_warnings_total": 1,
    "categories": [
      {
        "name": "§1.4 标点红线（阈值 = 0）",
        "red": 1,
        "soft": 0
      },
      {
        "name": "§1.5 戏剧化 / 大厂黑话 / 网络口语（阈值 = 0）",
        "red": 1,
        "soft": 0
      },
      {
        "name": "句长方差（阈值 ≥ 8）",
        "red": 0,
        "soft": 1
      }
    ]
  },
  "stats": {
    "char_count": 781,
    "sentence_count": 6,
    "paragraph_count": 10
  },
  "human_readable_output": "================================================\n       AI 味红线扫描 v4.3\n       文件：/var/folders/zj/nrnsj_1x7px29mb1h_xdrw140000gn/T/scan-ai-taste.XXXXXX.md.o1dvHDMi8A\n================================================\n\n▼ §1.4 标点红线（阈值 = 0）\n  ✓ 破折号 = 0\n  ✓ 括号内补充 = 0\n  ✗ §1.4.111 ASCII 直引号（中文上下文）: 5\n  6:**特征**：段落起手用\"坚持 XX\"动宾短语，分号衔接长句\n  14:> 坚持需求引领。聚焦企业和群众办事难点堵点问题，顺应企业和群众新要求、新期盼，积极推动企业和群众经常办理的事项向移动端延伸，提升移动政务服务供给水平，全面优化用户体验，推动政务服务事项从\"掌上可办\"向\"掌上好办\"转变。\n  22:1. **段首小标题**：每段以\"坚持 XX\"偏正短语作为段首小标题，然后接展开\n  25:4. **结尾克制**：不用\"具有重大意义\"等空话，用\"全面提升\"\"推动转变\"\"确保安全\"等具体动作\n  30:- 任何文件的\"基本原则\"\"主要原则\"\"指导思想\"章节\n  ✓ §1.4.111 直角引号 「」『』（港台 / 日式） = 0\n  ✓ §1.4.112 数学符号代替自然语言（+ = →） = 0\n  ✓ §1.4.113 中英紧贴缝合词（无空格） = 0\n  ✓ §1.4.117 中文段落英文标点穿插 = 0\n  ✓ §1.4.114 每段加粗冒号开头 = 0\n\n▼ §1.3 句式红线（阈值 = 0）\n  ✓ 否定平行结构 = 0\n  ✓ 如果说...那么... = 0\n\n▼ §1.1 中文词汇红线（阈值 = 0）\n  ✓ 中文红线词命中 = 0\n\n▼ §1.2 英文词汇红线（阈值 = 0）\n  ✓ 英文红线词命中 = 0\n\n▼ §1.1 三段式套壳（阈值 = 0）\n  ✓ 首先...其次...最后 = 0\n\n▼ §4 软阈值（密度限制，文长 5 句 → 千句密度阈值动态计算）\n  ✓ 已经: 0 / 阈值 ≤ 3\n  ✓ 核心: 0 / 阈值 ≤ 3\n  ✓ 这一: 0 / 阈值 ≤ 2\n\n▼ §1.5 戏剧化 / 大厂黑话 / 网络口语（阈值 = 0）\n  ✓ §1.5.1 战斗化叙事 = 0\n  ✗ §1.5.2 互联网大厂黑话: 1 处\n    12:> 坚持统筹规划。强化系统观念，完善标准规范，加强全国一体化平台移动端建设顶层设计，充分发挥国家政务服务平台移动端总枢纽作用，推动各地区各部门移动政务服务资源整合和政务服务平台移动端集约化建设，全面提升一体化服务能力。\n  ✓ §1.5.3 网络口语 / 网感词 = 0\n  ✓ §1.5.4 程序员 / 产品经理腔 = 0\n\n▼ §1.6 元注释 / 客服话术（阈值 = 0）\n  ✓ §1.6.1 元注释开头 = 0\n  ✓ §1.6.2 自我介绍 = 0\n  ✓ §1.6.3 免责声明 = 0\n  ✓ §1.6.4 服务话术段尾 = 0\n  ✓ §1.6.5 拟人化集体代词 = 0\n\n▼ §1.7 Wikipedia 长尾盲区（阈值 = 0）\n  ✓ §1.7.1 Reference markup bugs = 0\n  ✓ §1.7.2 Placeholder dates = 0\n  ✓ §1.7.5 Inline-header 段首标题 = 0\n  ✓ §1.7.7 Thematic breaks: 2 / 阈值 ≤ 5\n\n▼ §3 结构反模式（启发式提示）\n  ✓ 段尾分词挂总结: 0 处\n  ✓ 挑战与展望套壳 = 0\n\n▼ 句长方差（阈值 ≥ 8）\n  ⚠ 文本过短（5 句），跳过句长分析\n\n▼ 分组密度报表（按 anti-ai-taste-anchors.md 章节）\n  §1.1: 0 处\n  §1.2: 0 处\n  §1.3: 0 处\n  §1.4: 5 处\n  §1.5: 1 处\n  §1.6: 0 处\n  §1.7: 0 处\n\n================================================\n✗ FAIL — 有 2 项硬红线违规，禁止交付\n\n提示：加 --suggest-fix 获取改写建议；或运行 bash scripts/auto-fix-loop.sh \"$FILE\" 自动尝试 1 至 2 轮修复\n下一步：重写违规处，再次运行本脚本，直至全部通过\n"
}
